brand_info,item_no_or_size,ratings,feedback,price,oz_at_price,options,fragrance_info,limited_edition,image_url,url,image_filename,dominant_color
"['Giorgio Armani Beauty', 'EMPORIO ARMANI Stronger With You']","['ITEM ', '1977628']","[['5 stars', '270', '4 stars', '65', '3 stars', '11', '2 stars', '4', '1 star', '1']]","[['351 reviews'], ['1147', ' loves']]",['$59.00'],['1.7 oz/ 50 mL Eau de Toilette Spray'],"['Standard size', '1.0 oz/ 30 mL Eau de Toilette Spray', '1.7 oz/ 50 mL Eau de Toilette Spray']","['Fragrance Family:', ' Warm & Spicy', 'Scent Type:', ' Warm & Sweet Gourmands', 'Key Notes:', ' Pink Pepper Accord, Sage Essence, Candied Chestnut Accord', 'About:', ' Stronger With You is the fragrance of a man that lives in the present, molded by the energy of modernity. Unpredictable, he surprises with his originality, just like the scent’s spicy accord—a mix of cardamom, pink peppercorn, and violet leaves. He has inherited a confident elegance, with the easy insouciance of youth, conveyed by the sage at the fragrance’s aromatic heart. Charming, mysterious, and confident discover a boost of confidence and reveal that which is…Stronger With You.', 'What else you need to know:', ""Stronger With You and Because It's You are a pair of fragrances equal in strength. One perfectly feminine, the other generously masculine. Together they communicate, challenge, and seduce.""]",True,/productimages/sku/s1977628-main-Lhero.jpg,https://www.sephora.com/product/emporio-armani-stronger-with-you-P421783?icid2=products,s1977628-main-Lhero.jpg,"(186, 121, 74)"
"['Commodity', 'Whiskey']","['ITEM ', '1700020']","[['5 stars', '17', '4 stars', '7', '3 stars', '4', '2 stars', '2', '1 star', '2']]","[['32 reviews'], ['1896', ' loves']]",['$105.00'],['3.4 oz/ 100 mL Eau de Parfum Spray'],"['Standard size', '3.4 oz/ 100 mL Eau de Parfum Spray', 'Mini size', '0.33 oz/ 10 mL Eau de Parfum Spray']","['Fragrance Family:', ' Earthy & Woody\n', 'Scent Type:', ' Classic Woods\n', 'Key Notes:', ' Sage, Amber Oak, Mahogany\n', 'About:', 'The limited-edition Commodity Whiskey is inspired by American bourbon casks and rare Irish whiskies, a timeless indulgence is filled with flavor. Layers of mahogany, oak, sage, and cinnamon create this profound blend. Whiskey is a warm and spicy scent that is loved by both men and women. \n', 'Commodity Whiskey EDP is part of Commodity’s Black Collection, which includes scents that are complex, intense, and moody.\n', 'What else you need to know:', ' ""A beloved spirit distilled by the aromas of aged whiskey barrels, this timeless indulgence is filled with rich flavor. The smell takes me to the special days when I would pour a whiskey cocktail for my dad on late sunny afternoons where the last of the sunlight is peeking through with its golden amber rays oozing a warm, nuzzly feeling. It reveals an intense sweetness layered with an edge of woods.""—Ketrin Leka, Commodity Perfumer\n']",True,/productimages/sku/s1700020-main-Lhero.jpg,https://www.sephora.com/product/whiskey-P395006?icid2=products,s1700020-main-Lhero.jpg,"(200, 199, 196)"
"['Kilian', 'Straight To Heaven, White Cristal']","['ITEM ', '2056851']","[['5 stars', '3', '4 stars', '0', '3 stars', '0', '2 stars', '0', '1 star', '0']]","[['3 reviews'], ['512', ' loves']]",['$295.00'],"['1.7 oz/ 50 mL Eau de Parfum Spray', ' ', ' - comes with lacquered coffret pictured']","['Standard size', '1.7 oz/ 50 mL Eau de Parfum Spray', 'Mini size', '4 x 0.25 oz/ 7.5 mL Eau de Parfum Refillable Travel Sprays']","['Fragrance Family:', '\n', ' Warm & Spicy\n', '\n', 'Scent Type:', '\n', ' Woody Spices\n', '\n', 'Key Notes:', '\n', ' Dark Rum, Nutmeg, Spicy Patchouli\n', '\n', 'About:', '\n', ' Moments of ecstasy envelop the senses with Straight to Heaven, White Cristal. Smoldering with addictive sensuality, a burning splash of rich dark rum defines the opening. Its sweet gourmand chord is softened by creamy vanilla and dried fruit. Spicy patchouli pairs with the fresh, woodsy scent of cedarwood to finish, finding animalic harmony at long last.\n', '\n', 'The Straight to Heaven, white cristal Eau de Parfum is made for people who dare to explore their forbidden desires—throughout the day and night.\n', '\n', 'Each set contains:', '\n', 'Standard set:\n', '- 1.7 oz/ 50 ml Eau de Parfum\n', '- Lacquered coffret\n', '\n', 'Mini set:\n', '- 4 x 0.25 oz/ 7.5 mL Eau de Parfum\n', '- Refillable travel atomizer\n', '\n', 'What else you need to know:', '\n', ' The engraved silver-toned spray flacon shimmers. True luxury should last a lifetime, and as such, all by KILIAN fragrance flacons are designed to be refilled.\n', '\n', 'The 1.7oz/ 50mL Eau de Parfum comes with lacquered coffret pictured.\n', ' This refillable spray is a talisman. A shiny and matte black flacon—engraved with the Achille’s shield—reclines on a bed of satin. The black lacquered wood box with a protective tasseled key doubles as a keepsake to store pieces of precious jewelry. True luxury should last a lifetime, and as such, all Kilian fragrance flacons are designed to be refilled and all boxes are made to be reused\n']",True,/productimages/sku/s2056851-main-Lhero.jpg,https://www.sephora.com/product/straight-to-heaven-white-cristal-P429629?icid2=products,s2056851-main-Lhero.jpg,"(52, 52, 52)"
"['Viktor&Rolf', 'Spicebomb Extreme']","['ITEM ', '1798479']","[['5 stars', '6', '4 stars', '1', '3 stars', '0', '2 stars', '0', '1 star', '0']]","[['7 reviews'], ['547', ' loves']]",['$120.00'],['3.04 oz/ 90 mL  '],,"['Seductive. Intense. Overly sexy. Approach at your own risk. Spicebomb Extreme is an explosive composition highlighting aromatic lavender in a unique way—by mixing it with caraway and black pepper. The fragrance leaves a trail of hotness above masculine shades of tobacco and subtle, comfortable vanilla for a fiery interpretation of the original scent.\n', '\n', 'Notes:', '\n', ' Bergamot, Grapefruit, Cinnamon Leaf, Black Pepper, Lavander, Chilli, Saffron, Oud Accord, Tobacco Accord, Pimento, Cinnamon Leaf, Cumin.\n ', 'Style:', '\n', ' Explosive. Addictive. Seductive.\n']",True,/productimages/sku/s1798479-main-Lhero.jpg,https://www.sephora.com/product/spicebomb-extreme-P405501?icid2=products,s1798479-main-Lhero.jpg,"(223, 178, 120)"
"['Gucci', 'Pour Homme II']","['ITEM ', '997338']","[['5 stars', '98', '4 stars', '10', '3 stars', '2', '2 stars', '0', '1 star', '2']]","[['112 reviews'], ['1613', ' loves']]",['$90.00'],['3.3 oz/ 98 mL Eau de Toilette Spray'],,"['An alluring fragrance heightened by a sensual, spicy soul, Gucci Pour Homme II is the essence of young, masculine sensuality. The embodiment of relaxed refinement for the modern-minded man whose style is distinctive and effortless, this fresh, spicy, woody, scent is filled with playful attitude and charisma.', 'Notes:', 'Bergamot, Violet Leaves, Cinnamon, Pimento, Black Tea, Myrrh, Tobacco Leaves, White Musk, Olive Wood.', 'Style:', 'Seductive. Masculine. Free-spirited.']",True,/productimages/sku/s997338-main-Lhero.jpg,https://www.sephora.com/product/pour-homme-ii-P180726?icid2=products,s997338-main-Lhero.jpg,"(185, 182, 169)"
"['Jo Malone London', 'English Oak & Redcurrant Cologne']","['ITEM ', '2005973']","[['5 stars', '6', '4 stars', '1', '3 stars', '1', '2 stars', '0', '1 star', '0']]","[['8 reviews'], ['2154', ' loves']]",['$136.00'],['3.4 oz/ 100 mL  Spray'],"['Standard size', '1.0 oz/ 30 mL  Spray', '3.4 oz/ 100 mL  Spray']","['Fragrance Family:', ' Floral', 'Scent Type:', ' Fruity Florals', 'Key Notes:', ' Redcurrant, Rose, Roasted Oak', 'About:', 'Like the forest at dawn, the juicy bite of redcurrant, the zest of green mandarin, and the freshness of rose are softened with white musk and enveloped in roasted oak. The scent is bright, embracing, and bewitching. ', 'What else you need to know:', 'From colognes and candles to bath and body care, each Jo Malone London product comes presented in their signature gift box and ribbon.']",True,/productimages/sku/s2005973-main-Lhero.jpg,https://www.sephora.com/product/english-oak-redcurrant-cologne-P422440?icid2=products,s2005973-main-Lhero.jpg,"(235, 230, 215)"
"['Kilian', 'Vodka on the Rocks']","['ITEM ', '2056893']","[['5 stars', '1', '4 stars', '0', '3 stars', '0', '2 stars', '0', '1 star', '0']]","[['1 review'], ['337', ' loves']]",['$295.00'],"['1.7 oz/ 50 mL Eau de Parfum Spray', ' ', ' - comes with couture clutch pictured']","['Standard size', '1.7 oz/ 50 mL Eau de Parfum Spray', '4 x 0.25 oz/ 7.5 mL Eau de Parfum Refillable Travel Sprays']","['Fragrance Family:', '\n', ' Earthy & Woody \n', '\n', 'Scent Type:', '\n', ' Earthy Greens & Herbs \n', '\n', 'Key Notes:', '\n', ' Cardamom, Rose, Oakmoss \n', '\n', 'About:', '\n', ' Vodka on the Rocks Eau de Parfum is the perfect partner in crime for endless nights. Ice cracks beneath a stream of silky clear liquid, awakening deep curiosity for a taste.  Comprised of cool spices like cardamom and coriander plus aldehydes at the opening, Vodka on the Rocks evokes the frozen steam rising from ice cubes in a clear crystal tumbler. Bitter rhubarb accord, a splash of clear rose, and lily of the valley harmonize with an intoxicating leather undertone of sandalwood and oakmoss. \n', '\n', 'Each set contains:', '\n', 'Standard set:\n', '- 1.7 oz/ 50 ml Eau de Parfum\n', '- Lacquered coffret\n', '\n', 'Mini set:\n', '- 4 x 0.25 oz/ 7.5 mL Eau de Parfum\n', '- Refillable travel atomizer\n', '\n', 'What else you need to know:', '\n', '""The smell of a vodka cooled by ice."" \n\n', '\n', ' The 1.7oz/ 50mL Eau de Parfum comes with lacquered coffret pictured: \n', 'A magnificently weighted lacquered coffret made of warm, black wood and cool metallic bronze is crafted in the classic design of a vintage cigar case gracing an elegant side table. The flacon is all shimmering smoke, with opaque black glass and silver-toned accents. True luxury should last a lifetime, and as such, all Kilian fragrance flacons are designed to be refilled.\n']",True,/productimages/sku/s2056893-main-Lhero.jpg,https://www.sephora.com/product/vodka-on-rocks-P429625?icid2=products,s2056893-main-Lhero.jpg,"(41, 41, 43)"
"['rag & bone', 'Bergamot Eau de Parfum']","['SIZE ', '1.7 oz/ 50 mL', '•', 'ITEM ', '2010973']","[['5 stars', '12', '4 stars', '3', '3 stars', '2', '2 stars', '0', '1 star', '4']]","[['21 reviews'], ['1172', ' loves']]",['$150.00'],,,"['Fragrance Family:', 'Fresh', 'Scent Type:', ' Fresh Citrus & Fruits', 'Key Notes:', ' Bergamot, Ambrox, Cashmere Wood', 'About:', 'This fresh cologne imparts a feeling of sundrenched freshness and crisp white cotton reminiscent of summers in Italy. The long-lasting eau de parfum contrasts vibrant Italian bergamot with warm woods and amber for a scent that is bright and refreshing, airy but with a bracing edge that is neither masculine nor feminine. An undercurrent of ambergris runs throughout for a hint of sensuality.', 'Wear the scent day or night, summer or fall; Bergamot is never out of place. The scent will evolve and adapt to the unique signature of your skin.', 'What else you need to know:', "" The modest yet tactile glass bottle, which was molded at Heinz Glas’ 400-year-old factory in Tettau, Germany, represents the expert craftsmanship of rag & bone in a modern parfum. The six-digit code on the closure sticker represents the latitude and longitude of the origin for each scent's key ingredient.""]",True,/productimages/sku/s2010973-main-Lhero.jpg,https://www.sephora.com/product/bergamot-eau-de-parfum-P423532?icid2=products,s2010973-main-Lhero.jpg,"(236, 224, 213)"
"['Gucci', 'Guilty Black Pour Homme']","['ITEM ', '1511559']","[['5 stars', '46', '4 stars', '9', '3 stars', '4', '2 stars', '1', '1 star', '1']]","[['61 reviews'], ['1885', ' loves']]",['$92.00'],['3 oz/ 90 mL Eau de Toilette Spray'],"['Standard size', '1.6 oz/ 50 mL Eau de Toilette Spray', '3 oz/ 90 mL Eau de Toilette Spray']","[""The lovers' passion is encapsulated in Gucci Guilty Black Pour Homme. They bring out the most scandalous sides of each other: alone they are magnificent, together irrepressible. Fearless in their passion, they are brazen, shameless, unpredictable—ready for each and every explosive encounter. Their attraction is instinctive: they go where they sense danger and each other. \n"", 'Too much is never enough for our young hedonists, who drive each other to stray ever darker. Life is thrilling and meant to be lived to the fullest. Again and again, they give in to pleasure and the excitement of breaking the rules. \n', 'Gucci Guilty Black Pour Homme is a daring aromatique fougere, inviting you to indulge in your deepest desires.\n\n', 'Notes:', ' Lavender, Coriander, Orange Flower, Patchouli.\n']",True,/productimages/sku/s1511559-main-Lhero.jpg,https://www.sephora.com/product/guilty-black-pour-homme-P378659?icid2=products,s1511559-main-Lhero.jpg,"(30, 39, 38)"
"['Jo Malone London', 'Dark Amber & Ginger Lily Cologne Intense']","['ITEM ', '1946839']","[['5 stars', '6', '4 stars', '2', '3 stars', '1', '2 stars', '1', '1 star', '0']]","[['10 reviews'], ['1576', ' loves']]",['$180.00'],['3.4 oz/ 100 mL  Spray'],"['Standard size', '1.7 oz/ 50 mL  Spray', '3.4 oz/ 100 mL  Spray']","['Fragrance Family:', ' Floral', 'Scent Type:', ' Warm Florals', 'Key Notes:', ' Black Cardamom, Black Orchid, Kyara Incense', 'About:', ' Rare kyara wood—prized in the Kohdo ceremony, the highly ritualized Japanese art of incense appreciation—is enriched with amber and black orchid and illuminated by the clean sensuality of black cardamom, ginger, and water lily. The result is a sensual and distinctive fragrance.', 'What else you need to know:', 'From colognes and candles to bath and body care, each Jo Malone London product comes presented in their signature gift box and ribbon.']",True,/productimages/sku/s1946839-main-Lhero.jpg,https://www.sephora.com/product/dark-amber-ginger-lily-cologne-intense-P417190?icid2=products,s1946839-main-Lhero.jpg,"(40, 32, 28)"
"['MAISON MARGIELA', '’REPLICA’ At The Barber’s']","['ITEM ', '1693696']","[['5 stars', '36', '4 stars', '8', '3 stars', '2', '2 stars', '1', '1 star', '7']]","[['54 reviews'], ['2820', ' loves']]",['$126.00'],['3.4 oz/ 100 mL Eau De Toilette Spray'],,"['Fragrance Family:', ' Earthy & Woody', 'Scent Type:', ' Citrus & Woods', 'Key Notes:', ' Basil Accord, Lavendar, Tonka Bean', 'About:', "" At the Barber's is a woody, citrusy fragrance that recalls the relaxing memory of a classic, masculine ritual with invigorating notes of basil accord and sensorial lavender."", 'The creaking of a wooden sign swaying in the breeze welcomes you to a local barber shop. Take in the rhythmic sound of a shaving brush sliding through lavender soapsuds, and the dry friction of a straight razor brushing against a leather strap. Black pepper and rosemary invigorate your senses, clearing your mind. Feel the soft rustling of a fresh, white towel combine with the natural scent of your skin. ', "" At the Barber's is an aromatic, earthy, and woody fragrance that gives off the sensation of balance and purity. Cleansing and fresh, this eau de toilette fragrance resides within the ‘REPLICA’ Memories Collection—a family of scents designed to evoke personal memories that each one of us can recall. "", 'What else you need to know:', ' The silhouette of each ‘REPLICA’ bottle is inspired by classic apothecary jars, allowing the collection to be instantly identifiable. Each bottle carries a 100 percent cotton label, which is printed using black ink text and resembles the tags used on the clothing and accessories for the ‘REPLICA’ couture collection. The unique pumps are wrapped with a rope to symbolize the authentic reproduction of the original ‘REPLICA’ couture line.', ' The same label concept is carried onto the packaging of each fragrance. Each carton label is associated with a polaroid photograph depicting a fleeting moment captured in muted colors and soft light: a poetic allusion to the story behind each fragrance.', 'To wardrobe your fragrance, layer ‘REPLICA’ Filter Blur to convey a softer memory. Take your fragrance from day to night by layering ‘REPLICA’ Filter Glow to brighten and accentuate your fragrance.']",True,/productimages/sku/s1693696-main-Lhero.jpg,https://www.sephora.com/product/at-barber-shop-P394151?icid2=products,s1693696-main-Lhero.jpg,"(213, 212, 208)"
"['Acqua Di Parma', 'Colonia']","['ITEM ', '967083']","[['5 stars', '46', '4 stars', '8', '3 stars', '6', '2 stars', '4', '1 star', '5']]","[['69 reviews'], ['1779', ' loves']]",['$110.00'],['1.7 oz/ 50 mL Eau de Cologne Spray'],"['Standard size', '1.7 oz/ 50 mL Eau de Cologne Spray', '3.4 oz/ 101 mL Eau de Cologne Spray']","['An elegant timeless scent filled with a fresh, luminous blend of natural ingredients like Bulgarian rose, Sicilian citrus fruits, lavender, and verbena.', 'Notes:', 'Bergamot, Citrus, Lemon, Bitter Orange, Sweet Orange, English Lavender, Bulgarian or Damascene Rose, Verbena, Clary Sage, Rosemary, Cedarwood, Patchouli, Sandalwood, Vetiver, Oakmoss.', 'Style:', 'Classic. Timeless. Natural.']",True,/productimages/sku/s967083-main-Lhero.jpg,https://www.sephora.com/product/colonia-P163604?icid2=products,s967083-main-Lhero.jpg,"(232, 230, 206)"
"['Kilian', 'Black Phantom - ""Memento Mori""']","['ITEM ', '2056877']","[['5 stars', '5', '4 stars', '0', '3 stars', '0', '2 stars', '0', '1 star', '0']]","[['5 reviews'], ['1325', ' loves']]",['$295.00'],"['1.7 oz/ 50 mL Eau de Parfum Spray', ' ', ' - comes with lacquered coffret pictured']","['Standard size', '1.7 oz/ 50 mL Eau de Parfum Spray', 'Mini size', '4 x 0.25 oz/ 7.5 mL Eau de Parfum Refillable Travel Sprays']","['Fragrance Family:', '\n', ' Warm & Spicy\n', '\n', 'Scent Type:', '\n', ' Woody Spice\n', '\n', 'Key Notes:', '\n', ' Rum, Coffee, Vetiver\n', '\n', 'About:', '\n', ' On turbulent seas, an inescapably transient pirate ship braves black waters, leagues deep in mystery. Black Phantom ""Memento Mori"" reveals its hidden treasures to the curious nose in waves—a gourmand woodsy harmony. Rum accord from Martinique—akin to ‘pirates water’—spikes the scent of strong coffee at its heart, balanced by vetiver essence. A deadly bite of cyanide accord hides menacingly, like the smile from death itself. Smile back as sugar cane and dark, creamy sandalwood assures each trying journey holds a sweet reward.  \n', '\n', ""The Black Phantom, Memento Mori Eau de Parfum is made for daring people who need a partner's in crime for their nocturnal adventures.  \n"", '\n', 'Each set contains:', '\n', 'Standard set:\n', '- 1.7 oz/ 50 ml Eau de Parfum\n', '- Lacquered coffret\n', '\n', 'Mini set:\n', '- 4 x 0.25 oz/ 7.5 mL Eau de Parfum\n', '- Refillable travel atomizer\n', '\n', 'What else you need to know:', '\n', ' ""A little party never killed nobody.""\n', '\n', 'The 1.7oz/ 50mL Eau de Parfum comes with lacquered coffret pictured:\n', ' Unearth Black Phantom Memento Mori Refillable Spray. Under lock and tasseled key, the flacon is carved with the Achilles’ Shield as a symbol of protection and finished with monogram-engraved gunmetal details. A smiling skull rises like a monument atop a black lacquered wooden coffret, illuminating a display of grim magnificence. True luxury should last a lifetime, and as such, all Kilian fragrance flacons are designed to be refilled.\n\n\n\n']",True,/productimages/sku/s2056877-main-Lhero.jpg,https://www.sephora.com/product/black-phantom-memento-mori-P429627?skuId=2056877&icid2=products,s2056877-main-Lhero.jpg,"(43, 43, 44)"
"['HERMÈS', 'Eau de Citron Noir']","['ITEM ', '2043552']","[['5 stars', '3', '4 stars', '0', '3 stars', '0', '2 stars', '1', '1 star', '0']]","[['3 reviews'], ['455', ' loves']]",['$95.00'],['1.6 oz/ 50 mL Eau de Cologne Spray'],"['Standard size', '1.6 oz/ 50 mL Eau de Cologne Spray', '3.3 oz/ 100 mL Eau de Cologne Spray']","['Fragrance Family:', ' Fresh', 'Scent Type:', ' Fresh Citrus and Fruits', 'Key Notes:', ' Lemon, Black Tea, Guaiac Wood', 'About:', ' The striking and explosive vitality of citrus fruits combined with the depth of subtle smoky and woody notes of black lime. Eau de citron noir offers a unique and paradoxical imprint, a surprisingly persistent freshness which rises to the challenge of tenacity: it is the midday-to-midnight cologne.', 'What else you need to know:', '""Following a path through the olfactory universe of hesperidia led me into a vast world, dotted with surprises, with citrus fruits.  Finger lime, Buddha\'s hand fruit, Eureka lemon... So many unusual varieties of citrus appealed to me, but it was the smoky and distinguished black lime that finally stood out as the key note.""—Christine Nagel']",True,/productimages/sku/s2043552-main-Lhero.jpg,https://www.sephora.com/product/eau-de-citron-noir-P429076?icid2=products,s2043552-main-Lhero.jpg,"(15, 105, 146)"
"['Giorgio Armani Beauty', 'Armani Code']","['ITEM ', '826743']","[['5 stars', '194', '4 stars', '24', '3 stars', '7', '2 stars', '3', '1 star', '2']]","[['230 reviews'], ['4883', ' loves']]",['$68.00'],['1.7 oz/ 50 mL Eau de Toilette Spray'],"['Standard size', '1.7 oz/ 50 mL Eau de Toilette Spray', '2.5 oz/ 75 mL Eau de Toilette Spray', 'Mini size', '0.67 oz Eau de Toilette Spray', 'Value size', '4.2 oz/ 125 mL Eau de Toilette Spray']","['A seductive fragrance for men, Armani Code is a sexy blend of fresh lemon and bergamot softened with hints of orange tree blossom and warmed with soothing guaiac wood, and tonka bean.', 'Notes:', 'Lemon, Bergamot, Aromatic Mediterranean Notes,  Guaiac Wood, Tonka Bean.', 'Style:', ' Fresh. Sexy. Masculine.']",True,/productimages/sku/s826743-main-Lhero.jpg,https://www.sephora.com/product/armani-code-P96611?icid2=products,s826743-main-Lhero.jpg,"(9, 13, 13)"
"['CLINIQUE', 'Clinique Happy for Men']","['ITEM ', '346494']","[['5 stars', '67', '4 stars', '7', '3 stars', '0', '2 stars', '0', '1 star', '1']]","[['75 reviews'], ['1498', ' loves']]",['$52.00'],['1.7 oz/ 50 mL Eau de Toilette Spray'],"['Standard size', '1.7 oz/ 50 mL Eau de Toilette Spray', '3.4 oz/ 100 mL Eau de Toilette Spray']","['First there was Clinique Happy. A hint of citrus, a wealth of flowers. A mix of emotions. Now, introducing Clinique Happy for Men. Wear it and be happy.', 'Notes:', 'Kaffir Lime, Kalamanzi Fruit, Mandarin, Green Notes, Cedar, Mediterranean Cypress, Guiacwood.', 'Style:', 'Crisp. Clean. Cool.']",True,/productimages/sku/s346494-main-Lhero.jpg,https://www.sephora.com/product/clinique-happy-for-men-P122635?icid2=products,s346494-main-Lhero.jpg,"(243, 128, 29)"
"['TOM FORD', 'Tobacco Oud Intense']","['SIZE ', '1.7 oz/ 50 mL', '•', 'ITEM ', '2128098']",,"[['0 reviews'], ['65', ' loves']]",['$320.00'],,,"['Fragrance Family:', ' Warm & Spicy', 'Scent Type:', ' Woody Spice', 'Key Notes:', ' Raspberry, Tobacco Leaf Accord, Agarwood Accord', 'About:', ' Tom Ford Tobacco Oud Intense unleashes a fiery force ignited by amplified concentrations of tobacco leaf and rare oud. Smoky and smooth, the mystical depths of Tobacco Oud intoxicate into a deeper realm of decadence.']",True,/productimages/sku/s2128098-main-Lhero.jpg,https://www.sephora.com/product/tobacco-oud-intense-P434331?icid2=products,s2128098-main-Lhero.jpg,"(55, 49, 44)"
"['Ralph Lauren', 'Polo Blue']","['ITEM ', '627760']","[['5 stars', '130', '4 stars', '31', '3 stars', '4', '2 stars', '0', '1 star', '3']]","[['168 reviews'], ['2191', ' loves']]",['$69.00'],['2.5 oz/ 75 mL Eau de Toilette Spray'],"['Standard size', '2.5 oz/ 75 mL Eau de Toilette Spray', '4.2 oz/ 125 mL Eau de Toilette Spray']","['Polo Blue evokes a feeling of the freedom of the big, blue sky and the energy of the open waters, combined with an invigorating blast of fresh air. This lush fragrance for men is a fresh blend of aquatic accords combined with spicy basil, verbena, and clary sage, softened with soothing notes of washed suede, velvety moss, and sheer musk.', 'Notes:', 'Melon de Cavaillon, Lush Accord, Lush Watery Melon, Fresh Sliced Cucumber, Tangerine, Clary Sage Absolute, Geranium, Basil Verbena, Washed Suede, Velvety Moss, Amber Wood, Patchouli Coeur, Sheer Musk.', 'Style:', 'A crystal blue sensation.']",True,/productimages/sku/s627760-main-Lhero.jpg,https://www.sephora.com/product/polo-blue-P36740?icid2=products,s627760-main-Lhero.jpg,"(7, 9, 141)"
"['Givenchy', 'Play Intense']","['ITEM ', '1180280']","[['5 stars', '83', '4 stars', '8', '3 stars', '1', '2 stars', '0', '1 star', '0']]","[['92 reviews'], ['1015', ' loves']]",['$65.00'],"[<span class=""css-blx10h"" comps=""[object Object]"" data-comp=""Text"">only a few left<!-- --> - </span>, '1.7 oz/ 50 mL Eau de Toilette Spray']","['Standard size', '1.7 oz/ 50 mL Eau de Toilette Spray']","['Wanna Live? Just Play! Extremely modern yet totally timeless, Play offers a multisensorial experience available in two compositions. Both fragrances are centered around the Amyris wood, a Caribbean wood that possesses a warm and sensual tonality that gives Play its signature radiance. PLAY Eau De Toilette Intense is woody oriental and captivates with its rich texture and tonka bean trail.', 'Notes:', 'Top notes: Bergamot and mandarin orange.', 'Middle notes: Amyris wood, pink pepper, and coffee wood accord.', 'Base notes: Labdanum, tonka bean, vetyver, and patchouli.', 'Style:', ' Seductive. Warm. Daring. ', ' ', ' ', ""Get a sneak peek behind the scenes at Givenchy's new music-inspired scent Play.""]",True,/productimages/sku/s1180280-main-Lhero.jpg,https://www.sephora.com/product/play-intense-P238415?skuId=1180280&icid2=products,s1180280-main-Lhero.jpg,"(37, 37, 35)"
