brand_info,item_no_or_size,ratings,feedback,price,oz_at_price,options,fragrance_info,limited_edition,image_url,url,image_filename,dominant_color
"['rag & bone', 'Oud Eau de Parfum']","['SIZE ', '1.7 oz/ 50 mL', '•', 'ITEM ', '2011013']","[['5 stars', '0', '4 stars', '0', '3 stars', '0', '2 stars', '1', '1 star', '0']]","[['1 review'], ['148', ' loves']]",['$150.00'],,,"['Fragrance Family:', 'Warm & Spicy', 'Scent Type:', ' Woody Spices', 'Key Notes:', ' Incense, Guaiac Wood, Ambergris, Cistus Labdanum', 'About:', 'This long-lasting eau de parfum entices with ancient woods enveloped in exotic spices and smooth leather. Tranquil and dark like a desert at night, the agar oud brings a mysterious depth to the experience as the fragrance dries on your skin. This is a complex and challenging scent for the fragrance sophisticate.', 'Wear the scent for a chic evening event or intimate cocktails. Fragrance is personal and intimate on the skin. The scent will evolve and adapt to the unique signature of your skin.', 'What else you need to know:', "" The modest yet tactile glass bottle, which was molded at Heinz Glas’ 400-year-old factory in Tettau, Germany, represents the expert craftsmanship of rag & bone in a modern parfum. The six-digit code on the closure sticker represents the latitude and longitude of the origin for each scent's key ingredient.""]",True,/productimages/sku/s2011013-main-Lhero.jpg,https://www.sephora.com/product/oud-eau-de-parfum-P423528?icid2=products,s2011013-main-Lhero.jpg,"(230, 224, 218)"
"['Givenchy', 'Gentlemen Only Intense']","['ITEM ', '1620855']","[['5 stars', '7', '4 stars', '2', '3 stars', '0', '2 stars', '0', '1 star', '0']]","[['9 reviews'], ['446', ' loves']]",['$93.00'],['3.3 oz/ 100 mL Eau de Toilette Spray'],"['Standard size', '3.3 oz/ 100 mL Eau de Toilette Spray']","['Encounter a new fragrance, rich with audacious notes of peppercorn and patchouli. This is Gentlemen Only Intense, a modern, woody-amber version of the original Gentlemen Only eau de toilette. The fragrance combines bold tonka bean with leather and hide accords for a truly sensual and addictive signature. The fragrance immediately stands out for modern men who proudly assert their sensual side without straying from their natural elegance.\n', '\n', 'The bottle is a darker version of the iconic and masculine Gentlemen Only bottle.\n', '\n', 'Notes:', '\n', 'Leather and Hide Accords, Peppercorn Trio, Tonka Bean.\n', 'Style:', '\n', 'Sensual. Masculine. Addictive.\n']",True,/productimages/sku/s1620855-main-Lhero.jpg,https://www.sephora.com/product/gentlemen-only-intense-P389114?skuId=1620855&icid2=products,s1620855-main-Lhero.jpg,"(225, 225, 227)"
"['Gucci', 'Made to Measure']","['ITEM ', '1566801']","[['5 stars', '32', '4 stars', '4', '3 stars', '1', '2 stars', '2', '1 star', '2']]","[['41 reviews'], ['1160', ' loves']]",['$75.00'],['1.7 oz/ 50 mL Eau de Toilette Spray'],"['Standard size', '1.7 oz/ 50 mL Eau de Toilette Spray', '3 oz/ 90 mL Eau de Toilette Spray']","[""The Gucci Made to Measure fragrance is intensely masculine, created for the man who demands the very best—a man whom others aspire to be. It's inspired by the Gucci Made to Measure suit and specially crafted with the Gucci philosophy of attention to detail.\n"", '\n', 'Notes:', '\n', 'Calabrian Bergamot,  French Lavender, Anis Seed, Sri Lankan Nutmeg, Juniper Berry, Cistus Labdanum, Patchouli, Leather.\n', 'Style:', '\n', 'Masculine. Sophisticated. Empowered.\n']",True,/productimages/sku/s1566801-main-Lhero.jpg,https://www.sephora.com/product/made-to-measure-P382742?icid2=products,s1566801-main-Lhero.jpg,"(213, 211, 205)"
"['Commodity', 'Orris Travel Spray']","['ITEM ', '1898352']","[['5 stars', '2', '4 stars', '0', '3 stars', '0', '2 stars', '0', '1 star', '0']]","[['2 reviews'], ['643', ' loves']]",['$30.00'],['0.33 oz/ 10 mL Eau de Parfum Travel Spray'],"['Mini size', '0.33 oz/ 10 mL Eau de Parfum Travel Spray']","['Fragrance Family:', 'Floral', 'Scent Type:', 'Warm Florals', 'Key Notes:', ' Italian Orris, Pink Peppercorn, White Lily of the Valley', 'About:', ' Commodity Orris is a contrasting duality between sparkling freshness and warm sensuality. Exquisite spices like pink pepper, coriander, and carrot seed are combined with the elegant tonality of orris to reveal a beautiful, fresh floralcy. ', 'Commodity Orris Eau de Parfum is part of Commodity’s Platinum Collection, which includes scents that are rich, indulgent, and luxurious.', 'What else you need to know:', ""What's special about this scent: Italian Orris—As one of the most expensive raw materials in a perfumer's palette, orris root's warm, woody, and powdery elegance offers incredible richness, rendering a fresh, wet quality that's contrasted with spicy, floral elements. "", '""Orris root was my muse for this fragrance. When I contrasted it with floral elements like iris and combined sparkling aldehydes, an unexpected, cool, effervescent effect was created—an inebriating, skin-like sensuality.""—Stephen Nilsen, Commodity Perfumer']",True,/productimages/sku/s1898352-main-Lhero.jpg,https://www.sephora.com/product/orris-travel-spray-P417016?icid2=products,s1898352-main-Lhero.jpg,"(203, 200, 197)"
"['Jo Malone London', 'Wood Sage & Sea Salt Body & Hand Wash']","['SIZE ', '8.5 oz/ 250 mL', '•', 'ITEM ', '1946979']","[['5 stars', '5', '4 stars', '0', '3 stars', '0', '2 stars', '0', '1 star', '0']]","[['5 reviews'], ['1599', ' loves']]",['$40.00'],,,"['Fragrance Family:', ' Fresh', 'Scent Type:', ' Fresh Aquatics', 'Key Notes:', ' Ambrette Seeds, Sea Salt, Sage', 'About:', ' This refreshing body and hand wash gently cleanses and deliciously scents your skin, leaving body and hands conditioned and soft. Its crystal clear gel transforms into a rich lather and its uplifting fragrance fills the bathroom, immersing you in delicate scent.', ' Escape the everyday along the windswept shore where white waves break and the air is fresh with sea salt and spray. Alive with the mineral scent of the rugged cliffs mingled with the woody earthiness of sage, this fragrance is lively, spirited, and totally joyful.', 'What else you need to know:', ' From colognes and candles to bath and body care, each Jo Malone London product comes presented in their signature gift box and ribbon.']",True,/productimages/sku/s1946979-main-Lhero.jpg,https://www.sephora.com/product/wood-sage-sea-salt-body-hand-wash-P417206?icid2=products,s1946979-main-Lhero.jpg,"(225, 221, 214)"
"['Viktor&Rolf', 'Spicebomb Deodorant Stick']","['SIZE ', '2.6 oz', '•', 'ITEM ', '1605294']","[['5 stars', '7', '4 stars', '1', '3 stars', '1', '2 stars', '0', '1 star', '0']]","[['9 reviews'], ['566', ' loves']]",['$29.00'],,,"['In 2005, Viktor&Rolf launched its first bomb: a profusion of flowers in a feminine perfume, sensual to the point of excess—Flowerbomb. Today, it is the turn of the masculine codes of perfumery to be dynamited: Spicebomb Deodorant Stick offers us the promise of a concentrate with an explosive personality. Deliberately powerful, exaggeratedly sensual, decidedly audacious. \n', '\nAn explosive encounter between two accords with detonating tones: the first, explosive, fuses zesty, fresh notes while the cold spices leave their icy bite. The second, addictive, combines a middle note of incandescent spices with a wholly masculine combination of leather and tobacco as well as the brute force of vetiver. \n', 'Notes:', '\nBergamot, Grapefruit, Cinnamon Leaf, Pink Pepper, Lavandin, Chilli, Saffron, Elemi, Vetiver, Balsam Fir, Tobacco Accord, White Leather Accord. \n', 'Style:', '\n', ' Explosive. Addictive. Seductive.']",True,/productimages/sku/s1605294-main-Lhero.jpg,https://www.sephora.com/product/spicebomb-deodorant-stick-P387626?icid2=products,s1605294-main-Lhero.jpg,"(214, 214, 213)"
"['John Varvatos', 'Artisan Black Edition']","['ITEM ', '1325588']","[['5 stars', '19', '4 stars', '4', '3 stars', '0', '2 stars', '1', '1 star', '1']]","[['25 reviews'], ['557', ' loves']]",['$66.00'],['2.5 oz/ 75 mL Eau de Toilette Spray'],"['Standard size', '2.5 oz/ 75 mL Eau de Toilette Spray']","[""Introducing Artisan Black, a bold, new, limited-edition scent from John Varvatos. A dark, woodsy interpretation of the original Artisan fragrance, Artisan Black showcases the brand's signature mix of old world craftsmanship with a modern edge. The refreshing cologne evolves into a deep masculine structure, revealing a background of sensual woody and leathery accents."", ' The distinctly masculine flask is housed in a hand-woven, black rattan with signature intricacies that mark a one-of-a kind creation.']",True,/productimages/sku/s1325588-main-Lhero.jpg,https://www.sephora.com/product/artisan-black-edition-P260602?icid2=products,s1325588-main-Lhero.jpg,"(33, 32, 34)"
brand_info,item_no_or_size,ratings,feedback,price,oz_at_price,options,fragrance_info,limited_edition,image_url,url,image_url,
brand_info,item_no_or_size,ratings,feedback,price,oz_at_price,options,fragrance_info,limited_edition,image_url,url,image_url,
"['HERMÈS', 'Eau de pamplemousse rose']","['ITEM ', '1232792']","[['5 stars', '4', '4 stars', '5', '3 stars', '0', '2 stars', '0', '1 star', '1']]","[['10 reviews'], ['1281', ' loves']]",['$130.00'],['3.3 oz/ 98 mL Eau de Cologne Spray'],"['Standard size', '3.3 oz Concentre Eau de Toilette Spray', '3.3 oz/ 98 mL Eau de Cologne Spray']","['Fragrance Family:', '\n', ' Fresh\n', '\n', 'Scent Type:', '\n', ' Fresh Citrus & Fruits\n', '\n', 'Key Notes:', '\n', ' Grapefruit Accord, Rose\n', '\n', 'About:', '\n', ' With its classic approach favoring the liveliness and freshness of citrus fruit, Eau de pamplemousse rose is distinctive for its modern writing style. The citrus theme of this novella, incarnated by grapefruit, takes on a new brilliance when it comes into contact with roses.\n\n', '\n', '""A bitter-sweet cologne: freedom in tradition.""—Jean-Claude Ellena, Parfumeur\n\n']",True,/productimages/sku/s1232792-main-Lhero.jpg,https://www.sephora.com/product/eau-de-pamplemousse-P375131?icid2=products,s1232792-main-Lhero.jpg,"(191, 224, 129)"
"['Paco Rabanne', 'Invictus Intense']","['ITEM ', '1971696']","[['5 stars', '6', '4 stars', '0', '3 stars', '0', '2 stars', '0', '1 star', '0']]","[['6 reviews'], ['334', ' loves']]",['$74.00'],['1.7 oz/ 50 mL Eau de Toilette Spray'],"['Standard size', '1.7 oz/ 50 mL Eau de Toilette Spray']","['Fragrance Family:', ' Warm & Spicy', 'Scent Type:', ' Cool Spices', 'Key Notes:', ' Orange Flower, Whiskey Cream, Salty Black Amber', 'About:', ' Intensity takes over in this powerful smash-up of spicy sophistication. Neroli oil blends with stimulating pepper and is heated through with a malt salty-amber accord, and dynamic wood notes. Salt, the hallmark of Invictus, and amber are added for an intensified, sensual effect and to create balance. Once again, two forces come face to face and then merge in a magnetic duel.']",True,/productimages/sku/s1971696-main-Lhero.jpg,https://www.sephora.com/product/invictus-intense-P418113?skuId=1971696&icid2=products,s1971696-main-Lhero.jpg,"(206, 205, 210)"
"['Commodity', 'Leather Travel Spray']","['ITEM ', '1898345']","[['5 stars', '4', '4 stars', '0', '3 stars', '0', '2 stars', '2', '1 star', '0']]","[['6 reviews'], ['514', ' loves']]",['$30.00'],['0.33 oz/ 10 mL Eau de Parfum Travel Spray'],,"['Fragrance Family:', ' Warm & Spicy', 'Scent Type:', ' Woody Spices', 'Key Notes:', ' Black Leather, Labdanum, Akigalawood', 'About:', "" Commodity Leather's composition shuns the usage of real leather, but utilizes the best natural raw materials. Rich and aromatic, the fragrance evokes not just the sensual scent of new leather, but also the texture, suppleness, and raw sexiness inherent to it."", 'Commodity Leather Eau de Parfum is part of Commodity’s Platinum Collection, which includes scents that are rich, indulgent, and luxurious.', 'What else you need to know:', '""Leather is a very personal and passionate source of inspiration for me. I wear black leather almost every day. I love the feeling of it, the way it sounds, the way it smells, its magnetism. My preference for leather is luxe, thick, ultra-shiny, velvety to the touch, and very redolent. I measure my leather by a mixture of shine, thickness, and suppleness, and of course, its sensual scent.""—Rodrigo Flores-Roux, Commodity Perfumer']",True,/productimages/sku/s1898345-main-Lhero.jpg,https://www.sephora.com/product/leather-travel-spray-P417018?icid2=products,s1898345-main-Lhero.jpg,"(203, 200, 198)"
"['John Varvatos', 'Artisan Acqua']","['ITEM ', '1587427']","[['5 stars', '33', '4 stars', '1', '3 stars', '0', '2 stars', '0', '1 star', '0']]","[['34 reviews'], ['1147', ' loves']]",['$69.00'],['2.5 oz/ 75 mL Eau de Toilette Spray'],"['Standard size', '2.5 oz/ 75 mL Eau de Toilette Spray']","['John Varvatos Artisan Acqua combines an invigorating citrus blend with accents of spices and herbs for a unique woody aroma that embodies the confidence, creativity, and passion of the modern man. A fresh scent with authentic roots, the Mediterranean-inspired fragrance brings the intricate designs and unique Italian hand finishing of the designer’s Artisan collection to life.\n', '\nThe fragrance opens with a citrus cocktail of tangelo, mandarin, and paradisamide, while galbanum, lentisque, and angelica root provide a fresh green harmony to the scent. As it dries, herbal spicy accents of clary sage, lavender, coriander, toscanol®, and basil complement the notes of geranium, palmarosa, and jasmine sambac resulting in a sensual masculine floral. A woody base of moss, patchouli, and fir balsam lingers, bringing a refined and artisanal touch to the fragrance.\n', '\nThe covering of each bottle is hand-woven from natural materials for a one-of-a-kind creation. As a result of the meticulous attention to detail and high quality craftsmanship, each fragrance possesses its own eclectic character and an unmistakable sense of crafted luxury and charm.\n', '\n', 'Notes:', '\n', ' Tangelo, Mandarin, Paradisamide, Galbanum, Lentisque, Angelica Root, Sage, Lavender, Coriander, Toscanol®, Basil, Geranium, Palmarosa, Jasmine Sambac, Moss, Patchouli, Fir Balsam.\n', 'Style:', '\n', 'Fresh.  Effortless. Enlightened.\n\n']",True,/productimages/sku/s1587427-main-Lhero.jpg,https://www.sephora.com/product/artisan-acqua-P385307?icid2=products,s1587427-main-Lhero.jpg,"(183, 147, 118)"
"[""L'Occitane"", 'Cedrat Deodorant']","['SIZE ', '2.6 oz/ 75 g', '•', 'ITEM ', '1720408']","[['5 stars', '8', '4 stars', '1', '3 stars', '1', '2 stars', '0', '1 star', '2']]","[['12 reviews'], ['1094', ' loves']]",['$19.00'],,,"['What it is:', '\n', 'An alcohol- and aluminum-free deodorant for men with the energizing scent of organic cedrat extract from Corsica.\n', '\n', 'What it is formulated to do:', '\n', "" This effective, non-sticky, men's formula dries fast to provide a feeling of freshness throughout the day. Formulated without alcohol or aluminum salts, it leaves skin with the energizing citrus notes of cedrat. \n"", '\n', 'What else you need to know:', '\n', ' Originally from Asia, cedrat was the first citrus fruit to reach the shores of Corsica, France. The Cedrat extract derived from the pulp was coveted for its skin-energizing properties. To this day, L’Occitane continues to harvest cedrat during the winter months on the island of Corsica at a small, organic cooperative.\n']",True,/productimages/sku/s1720408-main-Lhero.jpg,https://www.sephora.com/product/cedrat-deodorant-P397459?icid2=products,s1720408-main-Lhero.jpg,"(201, 194, 124)"
"['Jo Malone London', 'Tuberose Angelica Cologne Intense']","['ITEM ', '1946854']","[['5 stars', '4', '4 stars', '0', '3 stars', '1', '2 stars', '0', '1 star', '3']]","[['8 reviews'], ['1286', ' loves']]",['$185.00'],['3.4 oz/ 100 mL  Spray'],"['Standard size', '1.7 oz/ 50 mL  Spray', '3.4 oz/ 100 mL  Spray']","['Fragrance Family:', ' Floral', 'Scent Type:', ' Classic Florals', 'Key Notes:', ' Angelica, Tuberose, Amberwood', 'About:', ' The queen of white florals, tuberose is at the heart of this sensual fragrance. The note is touched with the green spiciness of angelica and the sumptuous warmth of amberwood creating an intoxicating and desirable impression.', 'What else you need to know:', 'From colognes and candles to bath and body care, each Jo Malone London product comes presented in their signature gift box and ribbon.']",True,/productimages/sku/s1946854-main-Lhero.jpg,https://www.sephora.com/product/tuberose-angelica-cologne-intense-P417194?icid2=products,s1946854-main-Lhero.jpg,"(39, 31, 28)"
"['Commodity', 'Vetiver Travel Spray']","['ITEM ', '1898378']","[['5 stars', '3', '4 stars', '0', '3 stars', '0', '2 stars', '0', '1 star', '0']]","[['3 reviews'], ['842', ' loves']]",['$30.00'],['0.33 oz/ 10 mL Eau de Parfum Travel Spray'],"['Mini size', '0.33 oz/ 10 mL Eau de Parfum Travel Spray']","['Fragrance Family:', ' Earthy & Woody', 'Scent Type:', ' Classic Woods', 'Key Notes:', ' Haitian Vetiver, Patchouli, Vintage Jasmine', 'About:', ' Commodity Vetiver is a marriage of golden, unctuous, woody aromas and exquisite tropical florals. It is both feminine and masculine, mild and powerful, with a fresh elegance and divine sensuality. ', 'Commodity Vetiver Eau de Parfum is part of Commodity’s Platinum Collection, which includes scents that are rich, indulgent, and luxurious.', 'What else you need to know:', ""What's special about this scent: Haitian Vetiver Oil—Created in a steam distillery in Les Cayes, Haiti, this vetiver oil comes from a fair trade-approved supply chain, and is considered to have the most refined and balanced qualities. Its woody and dry tones are nuanced by earthy, smoky, and nutty inflections. "", '""For me, being a perfumer is like being a chef or painter—taking ingredients and coming up with your own recipe, your own creation. I was about 16 years old when I first smelled vetiver, and it’s been one of my favorite raw materials ever since.""—Caroline Sabas, Commodity Perfumer']",True,/productimages/sku/s1898378-main-Lhero.jpg,https://www.sephora.com/product/vetiver-travel-spray-P417012?icid2=products,s1898378-main-Lhero.jpg,"(203, 200, 198)"
"['Kenzo', 'Pour Homme']","['ITEM ', '627711']","[['5 stars', '7', '4 stars', '1', '3 stars', '0', '2 stars', '1', '1 star', '0']]","[['9 reviews'], ['256', ' loves']]",['$86.00'],['3.4 oz/ 100 mL Eau de Toilette Spray'],"['Standard size', '3.4 oz/ 100 mL Eau de Toilette Spray']","['The first morning of the world...Pour Homme opens up new spaces, encouraging you to breathe in deeply. The very first fragrance ever created with marine notes, Pour Homme is full of astonishing contrasts. The ""bamboo-bottle,"" bent by the wind, is printed with finely veined leaves etched in the glass.', 'Notes:', 'Marine, Cloves, Nutmeg, Sandalwood, Vetiver.', 'Style:', 'For the man with no boundaries. Subtle and serene.']",True,/productimages/sku/s627711-main-Lhero.jpg,https://www.sephora.com/product/pour-homme-P0999?icid2=products,s627711-main-Lhero.jpg,"(48, 71, 92)"
"['Montblanc', 'Legend Body Spray']","['SIZE ', '6.6 oz/ 200 mL', '•', 'ITEM ', '1661214']","[['5 stars', '17', '4 stars', '2', '3 stars', '0', '2 stars', '0', '1 star', '0']]","[['19 reviews'], ['523', ' loves']]",['$22.00'],,,"['The Montblanc Legend man is confident and charismatic—an effortlessly seductive man who lives his feelings. \n', '\n', 'Montblanc Legend Eau de Toilette is the incarnation of a resolutely masculine fragrance, both modern and timeless, with depth, modernity, and the right amount of discreet mystery. The fragrance is a fresh fougére with top notes that are lively, bright, and clean, magnetic heart notes with a unique woody-floral tone, and a sensual dry down with an unforgettable signature of tonka beans and sandalwood.\n', '\n', 'Notes:', '\n', 'Italian Bergamot, French Lavandin, Pineapple Leaves, White Cedar, Rose, Fresh Jasmine, Pomarose™, Evernyl, Sandalwood, Tonka Beans.\n', 'Style:', '\n', 'Confident. Charismatic. Seductive.\n']",True,/productimages/sku/s1661214-main-Lhero.jpg,https://www.sephora.com/product/legend-body-spray-P390708?icid2=products,s1661214-main-Lhero.jpg,"(28, 28, 30)"
"['Commodity', 'Tea Travel Spray']","['ITEM ', '1699990']","[['5 stars', '4', '4 stars', '4', '3 stars', '1', '2 stars', '4', '1 star', '3']]","[['16 reviews'], ['1849', ' loves']]",['$26.00'],['0.33 oz/ 10 mL Eau de Parfum Spray'],"['Mini size', '0.33 oz/ 10 mL Eau de Parfum Spray']","['Fragrance Family:', ' Earthy & Woody', 'Scent Type:', ' Warm Woods', 'Key Notes:', ' Honey, Egyptian Basil, Tobacco', 'About:', 'Commodity Tea is infused with honey, as well as a rich, soothing blend of gourmand tea notes. Asian-inspired oolong tea, Egyptian basil, and warm tobacco notes convey a comforting, relaxing afternoon tea experience.', 'Commodity Tea Eau de Parfum is part of Commodity’s White Collection, which includes scents that are light, airy, and easy.', 'What else you need to know:', '""Treating myself to a spa day, being pampered with the aromatic essences massaged into my skin, while spending the afternoon sipping an exotic blend of tea for a relaxing, yet invigorating sensation. A quiet, mysterious reflection when I close my eyes and escape to a sense of balance and overall sense of well-being.""—Donna Ramanauskas, Commodity Perfumer']",True,/productimages/sku/s1699990-main-Lhero.jpg,https://www.sephora.com/product/tea-P395018?icid2=products,s1699990-main-Lhero.jpg,"(231, 228, 226)"
"['Atelier Cologne', 'Cedrat Enivrant Cologne Absolue Pure Perfume ']","['ITEM ', '1598432']","[['5 stars', '37', '4 stars', '18', '3 stars', '5', '2 stars', '4', '1 star', '1']]","[['65 reviews'], ['1719', ' loves']]","['$195.00', <div class=""css-9fv2tr"" comps=""[object Object]"" data-comp=""Box"">($223.00 value)</div>]",['6.7 oz/ 200 mL Cologne Absolue Pure Perfume  Spray'],"['Value size', '6.7 oz/ 200 mL Cologne Absolue Pure Perfume  Spray']","['The launch of Cédrat Enivrant celebrates a return to the origins of Atelier Cologne, the first maison de parfum dedicated entirely to cologne, the legendary fragrance classic. The creators, Sylvie Ganter and Christophe Cervasel gave birth to a new olfactive family, “Cologne Absolue”. Cédrat Enivrant completes their Collection Originale, now composed of six new colognes.  Designed primarily around citrus notes—the traditional ingredients of a cologne—and inspired by the French 75 cocktail, Cédrat Enivrant is for lovers of lemon and gin notes.\n', '\n', 'Notes:', '\n', 'Maroccan Cedrat, Lime, Bergamot, Chinese Mint, Egyptian Basilic,\nJuniper Berries, Tonka Bean, Vetiver, Elemi.\n', '\n', 'Style:', '\n', 'Sophisticated. Effortless. Classic.\n']",True,/productimages/sku/s1598432-main-Lhero.jpg,https://www.sephora.com/product/cedrat-enivrant-cologne-absolue-P385175?icid2=products,s1598432-main-Lhero.jpg,"(234, 232, 168)"
"['HERMÈS', 'Voyage d’Hermès Deodorant Spray']","['SIZE ', '5 oz ', '•', 'ITEM ', '1436815']","[['5 stars', '2', '4 stars', '0', '3 stars', '0', '2 stars', '0', '1 star', '0']]","[['2 reviews'], ['288', ' loves']]",['$45.00'],,,"['What it is:', '\n', ' A fragranced formula that offers protection, freshness, and softness to the skin, for a sensation of comfort and well-being all day long.\n', '\n', 'What it does:', '\n', 'A novel that feeds on the imagination, Voyage d’Hermès expresses the long-standing and unusual relationship between the house and travel. An interplay of paradoxes, complements, and unexpected alliances support the premise of woody notes that are fresh yet musky, familiar yet surprising, hovering between impulsive and comforting, and equally at ease with men as with women. \n', '\n', ' ""An invitation to discover, meet, and share.""—Jean-Claude Ellena, Parfumeur\n', '\n', 'Notes:', 'Woody Fresh, Musky, Amber.\n']",True,/productimages/sku/s1436815-main-Lhero.jpg,https://www.sephora.com/product/voyage-d-hermes-deodorant-spray-P380631?icid2=products,s1436815-main-Lhero.jpg,"(228, 228, 228)"
"['Jo Malone London', 'Myrrh & Tonka Cologne Intense']","['ITEM ', '1946862']","[['5 stars', '12', '4 stars', '2', '3 stars', '1', '2 stars', '0', '1 star', '0']]","[['15 reviews'], ['2113', ' loves']]",['$185.00'],['3.4 oz/ 100 mL  Spray'],"['Standard size', '1.7 oz/ 50 mL  Spray', '3.4 oz/ 100 mL  Spray']","['Fragrance Family:', ' Warm & Spicy', 'Scent Type:', ' Warm & Sweet Gourmands', 'Key Notes:', ' Lavender, Omumbiri Myrrh, Tonka Bean', 'About:', ' The rich, hand-harvested sap of the Namibian myrrh tree, mingles with the warm almond and lush vanilla notes of the tonka bean for a noble and sensual fragrance.', 'What else you need to know:', 'From colognes and candles to bath and body care, each Jo Malone London product comes presented in their signature gift box and ribbon.']",True,/productimages/sku/s1946862-main-Lhero.jpg,https://www.sephora.com/product/myrrh-tonka-cologne-intense-P417192?icid2=products,s1946862-main-Lhero.jpg,"(39, 31, 28)"
"['DOLCE&GABBANA', 'Light Blue Pour Homme Deodorant']","['SIZE ', '2.4 oz/ 71 mL', '•', 'ITEM ', '1020007']","[['5 stars', '2', '4 stars', '1', '3 stars', '0', '2 stars', '1', '1 star', '1']]","[['5 reviews'], ['714', ' loves']]",['$29.00'],"['FORMULATION: ', ' ', 'Deodorant']",,"['Drawing upon their native home of Italy, this innovative design team have captured the sensuality of the Mediterranean. A refreshing blend of citrus notes combines perfectly with masculine woods and subtle spice to create a distinctive fragrance that epitomizes relaxed sophistication.', 'Notes:', 'Sicilian Mandarin, Frozen Grapefruit Peel, Bergamot, Juniper, Rosemary, Szechuan Pepper, Rosewood, Musk Wood, Incense, Oak Moss.', 'Style:', 'Mysterious. Confident. Sensual.']",True,/productimages/sku/s1020007-main-Lhero.jpg,https://www.sephora.com/product/light-blue-pour-homme-deodorant-P306859?icid2=products,s1020007-main-Lhero.jpg,"(143, 153, 168)"
